File_Path,Kirundi_Transcription,French_Translation,English_Translation,Domain,Machine_Suggestion,Source,Duration,Speaker_id,Age,Gender,word_count,char_count
,Urwaruka kandi na rwo rurakwiye kwijukira amashirahamwe.,Les adolescents devraient également se tourner vers les organisations.,Teenagers should also look to organizations.,general,,,,,,,7,56
,Urwo rwego rusabwa na bose.,Ce niveau est requis par tous.,This level is required by everyone.,general,,,,,,,5,27
,Urwânko rutēsha urwârwá.,La haine engendre la destruction et le mal.,Hatred breeds destruction and harm.,proverbs,,,,,,,3,24
,Urwĭba rwība umugabo.,Un voleur habile peut entrer dans une forteresse.,A skilled thief can enter a fortress.,proverbs,,,,,,,3,21
,Urya cāne ukīroga inzara.,Manger excessivement peut faire de la faim votre compagne constante.,Excessive eating can make hunger your constant companion.,proverbs,,,,,,,4,25
,Urya nk'úmugabo ukanigwa.,L'orgueil excessif et la cupidité insatiable conduisent souvent à une grave chute.,Excessive pride and insatiable greed often lead to a grave downfall.,proverbs,,,,,,,3,25
,Urímye ikibára hakamera inzúzi ntízibá arí izâwé.,"Si la récolte te surprend, ce n'est pas ta culture..","If the harvest surprises you, it's not your crop.",proverbs,,,,,,,7,49
,Urāmba cāne ukarīnda uruvyíno rw'îmbwá.,"Avec l'âge, certaines peurs perdent leur pouvoir.","With age, certain fears no longer hold power.",proverbs,,,,,,,5,39
,Usaba Imâna y'úwŭndi ikaguha amahere.,Ne demandez pas à Dieu ce qui dépasse votre destin.,Do not ask God for what is beyond your destiny.,proverbs,,,,,,,5,37
,Usaba inēra ukaba inēra.,Celui qui cherche de l'aide auprès d'une mauvaise personne hérite de ses manières.,He who seeks help from a bad person inherits their ways.,proverbs,,,,,,,4,24
,Usaba umwîzá mugasa.,Celui qui s'associe aux bons devient lui-même bon.,He who associates with the good becomes good himself.,proverbs,,,,,,,3,20
,Useka umubânyi ukavyūka músa.,Ce que tu moques aujourd'hui pourrait être ton propre reflet demain.,What you mock today may be your own reflection tomorrow.,proverbs,,,,,,,4,29
,"Ushâka kumenya urugero rwāwe rwó kwìíhāngāna, uratwāra Umwâna wāwe w'îmyâka itatu mu bugeni.","Si tu veux évaluer ton niveau de gentillesse, amène ton enfant de 3 ans à un mariage. ","If you want to gauge your kindness, bring your 3-year-old to a wedding. ",jokes,,,,,,,13,92
,"Ushīma kó ibīntu vyàázīmvye,..Kèéra twâgīye kuramutsa bā mâmá bàácu, bàárakubwîra nk'încúro icúmi ngo ""Ingo ufūngúre "" ukaguma wîyankīsha ugatīnda ukêmera,...","Pour comprendre à quel point les prix ont grimpé, imaginez ceci : Autrefois, quand nous rendions visite à nos tantes, elles nous répétaient mille fois de venir manger.","To grasp the extent of how prices have soared, consider this: Back in the day, when we visited our aunties, they'd insist a thousand times for us to come and eat. ",jokes,,,,,,,20,158
,Uta agatōngo ataco kakugíze kagatuma ku kăndi ngo urāmpōra.,Un traitement injuste peut pousser quelqu'un à chercher des alliés pour se venger.,Unjust treatment can lead someone to seek allies for vengeance.,proverbs,,,,,,,9,59
,Uta akarānga ukaba utâye ibānga.,"Perdre sa culture, c'est perdre son identité.",Losing culture means losing identity.,proverbs,,,,,,,5,32
,Utabikora uzohanwa,"Si vous ne le faites pas, vous serez puni",If you do not do it you will be punished,grammar,,,,,,,2,18
,"Utanditse neza, sinosoma ibikaratasi vyawe","Si tu n'as pas bien écrit, je ne lirai pas tes papiers","If you haven’t written well, I won’t read your papers",grammar,,,,,,,5,42
,"Utange ivyo uguhumanurwa kwawe, nk’uko Mose yageze","Offrez les choses pour votre purification, comme Moïse l'a ordonné","Offer the things for your cleansing, as Mose commanded",grammar,,,,,,,7,50
,"Utazi Ikirundi, burya uba waratakaje imizi.","Si vous ne connaissez pas le Kirundi, vous avez perdu vos racines.","If you don't know Kirundi, you have lost your roots.",general,,,,,,,6,43
,Uturorero:   Ivy'aha vyama mu nzira,Exemples : Ici Il ya toujours le désordre,Examples: Here there is always disorder,general,,,,,,,5,35
,Uturuka buká ugatāha bunyama.,Un mauvais début mène à une mauvaise fin.,A bad beginning leads to a bad ending.,proverbs,,,,,,,4,29
,Utw'ûmwôro twōmwēgēra.,"Ce qui vous appartient, gardez-le près de vous.","What belongs to you, keep it close to you.",proverbs,,,,,,,2,22
,Utwâwé ní utwó urāyé urîye.,Vos vrais biens sont ceux que vous pouvez saisir.,Your true belongings are those within your grasp.,proverbs,,,,,,,5,27
,Utāmbira umwămi atagushăka akakwīta umusazi.,Danser pour une pierre ne fera que vous rendre ridicule.,Dancing for a stone will only make you look foolish.,proverbs,,,,,,,5,44
,Utēka ubúsa ukamira ubŭndi.,"Si vous ne semez pas, vous ne récolterez pas.","If you don't sow, you won't reap.",proverbs,,,,,,,4,27
,Uvyiyumvirako iki?,Qu'est-ce que tu en penses?,What do you think?,general,,,,,,,2,18
,Uwabâye mwīzá aba muzima.,Un vrai homme est mesuré par la bonté dans son cœur.,A true man is measured by the goodness in his heart.,proverbs,,,,,,,4,25
,Uwabírimye sí we yabírīye.,"Il a attrapé le poisson, mais d'autres ont profité du repas.","He caught the fish, but others enjoyed the meal.",proverbs,,,,,,,4,26
,Uwagôwe aherekeza uwagôtse.,Ceux qui sont dans la misère sont ceux qui soutiendraient un traître.,Those in misery are the ones who would stand by a traitor's side.,proverbs,,,,,,,3,27
,Uwapfuye aba atsindanishirijwe icaha,Celui qui est mort serait justifié du péché,He that has died would be justified of sin,grammar,,,,,,,4,36
,Uwapfûye yarîhūse.,"Partis trop tôt, ils ont raté les marées changeantes.","Gone too soon, they missed the changing tides.",proverbs,,,,,,,2,18
,Uwatînye gupfá ntíyavûtse.,Celui qui a peur de tomber n'apprendra jamais à voler.,He who is afraid to fall will never learn to fly.,proverbs,,,,,,,3,26
clips/sound_humour/h23.mp3,Uwo inzara abonye mugenziwe atwawe n'impfyisi ati abari n'ababo barabaseha!,"""Seuls ceux qui ont de la famille sont approvisionnés"", comme disait l'homme lors d'une famine en voyant son voisin emmené par la hyène !","""Only those who have family are supplied,"" as the man said during a famine seeing his neighbor taken away by the hyena!",jokes,,,,,,,10,75
,Uwu munsi ni mwiza.,Cette journée est belle.,This day is beautiful.,general,,,,,,,4,19
,Uwubwîra uwŭmva ntávuníka.,"À une oreille attentive, peu de mots suffisent.","To a willing ear, few words are needed.",proverbs,,,,,,,3,26
,Uwubândwa ní we abāndá urūgi.,Seuls les intrépides relèvent les défis difficiles.,Only the fearless take on difficult tasks.,proverbs,,,,,,,5,29
,Uwubûndabūnda abonwa n'úwuhágaze.,Celui qui agit en secret peut être vu par des yeux invisibles.,The one who acts in secret may be witnessed by unseen eyes.,proverbs,,,,,,,3,33
,Uwubûranye ikinyóma aragítsīndanwa.,Le défenseur des mensonges tombe dans son propre piège.,The defender of lies falls into his own trap.,proverbs,,,,,,,3,35
,Uwudásavyé ntákirá.,"Si vous ne demandez pas, vous n'obtenez pas.","If you don't ask, you don't get.",proverbs,,,,,,,2,19
,Uwudáshōnjé ntáshērá.,Seul un estomac vide connaît la douleur de la mendicité.,Only an empty stomach knows the pain of begging.,proverbs,,,,,,,2,21
,Uwudásizé umwâna asiga umugáni.,"Même sans laisser de descendance, une personne devrait s'efforcer de créer un héritage durable par des actions significatives.","Even without leaving behind any offspring, a person should strive to create a lasting legacy through meaningful actions, .",proverbs,,,,,,,4,31
,Uwudátēyé ntásorόma.,"Si vous n'avez pas semé, vous ne pouvez pas vous attendre à récolter.","If you haven't sown, you can't expect to harvest.",proverbs,,,,,,,2,20
,Uwufíse amâso ahēndwa biké.,Celui qui a des yeux ne sera pas facilement trompé.,He who has eyes will not be easily fooled.,proverbs,,,,,,,4,27
,Uwufíse ikimuri ntáhakúrira hāsí.,"Dans le noir, la lumière empêche votre assiette de tomber.","In the dark, light keeps your plate from falling.",proverbs,,,,,,,4,33
,Uwufíse imbwá ntâtá igúfa.,Avoir un chien signifie ne pas gaspiller les os à la poubelle.,Having a dog means not wasting bones in the garbage.,proverbs,,,,,,,4,26
clips/sound_proverb/prov044.mp3,Uwugusize intambwe aba agusize,Le premier oiseau attrape le ver,The first bird catches the worm,proverbs,,,,,,,4,30
,Uwugômba isīmbo asīmba urugó.,"Quand tu désires vraiment quelque chose, tu dois t'efforcer sans relâche.","When you truly desire something, you must exert yourself relentlessly.",proverbs,,,,,,,4,29
,Uwugômba kugabana arazīnduka.,Celui qui souhaite être accordé par le roi doit venir tôt.,He who wishes to be granted by the king must come early.,proverbs,,,,,,,3,29
,Uwugôwe agōra Imâna.,L'âme misérable se tourne vers les cieux pour obtenir du soulagement.,The wretched soul turns to the heavens for relief.,proverbs,,,,,,,3,20
,Uwugôwe aragōka.,"Au milieu des troubles, les vulnérables peuvent abandonner leurs principes pour un gain personnel.","Amidst troubles, the vulnerable may forsake principles for personal gain.",proverbs,,,,,,,2,16
,Uwugôwe umuryāngo uramwākīra.,"Quand on est dans le besoin, les mains de la famille se tendent pour aider.","When one is in need, the family's hands extend to help.",proverbs,,,,,,,3,29
,Uwugúhanūra kurēndegera aba agúteze umushíbuká.,"Méfiez-vous de ceux qui prêchent l'insouciance, car ils peuvent chercher votre chute.","Be wary of the ones who preach carelessness, as they may be seeking your downfall.",proverbs,,,,,,,5,47
,Uwugúsavye umwūhīro aba agútaze umusêsekará.,Demander plus de vous est un souhait subtil pour votre abondance.,"Requesting more from you, is a subtle wish for your abundance.",proverbs,,,,,,,5,44
,Uwugútānze gukáraba agutānga kubega.,L'oiseau matinal attrape le ver.,The early bird catches the worm.,proverbs,,,,,,,4,36
,Uwuhána inzara arayirimira.,"Pour lutter contre la faim, il faut travailler plus dur.","To fight against hunger, you need to work harder.",proverbs,,,,,,,3,27
,Uwuhána umurozi amubītsa umwâna.,"Si vous voulez tester la vraie nature d'une personne, confiez-lui quelque chose de précieux.","If you want to test a person's true nature, entrust them with something valuable.",proverbs,,,,,,,4,32
,Uwuhânzwe n'îsînzí ntásīnzîra.,"Quand on est entouré d'ennemis, on dort d'un œil ouvert.","When surrounded by enemies, sleep with one eye open.",proverbs,,,,,,,3,30
,Uwuhâwe n'Îmâna ntíyāmbúrwa n'úmuyaga.,La serrure de ta fortune ne s'ouvre qu'avec ta propre clé.,The lock to your fortune only opens to your key.,proverbs,,,,,,,4,38
,Uwuhâwe n'úmwămi acānira Uburŭndi búbona.,"Celui qui est accordé par le roi prend son repas en paix, sans interférence.","He who is granted by the king enjoys his meal in peace, without interference.",proverbs,,,,,,,5,41
,Uwuhâwe n'úmwămi atēkera Uburŭndi búbona.,"Celui qui est accordé par le roi prend son repas en paix, sans interférence.","He who is granted by the king enjoys his meal in peace, without interference.",proverbs,,,,,,,5,41
,Uwuhênzwe n'ágahêngwé acāna inkīnzo.,Celui qui est bercé par la paix peut oublier le besoin d'une épée.,He who is lulled by peace may forget the need for a sword.,proverbs,,,,,,,4,36
,Uwuhôngera umwânsi amara inká.,"Quand vous cherchez le pardon d'un ennemi avec des cadeaux, cela devient un schéma récurrent.","When you seek forgiveness from an enemy with gifts, it becomes a recurring pattern.",proverbs,,,,,,,4,30
,Uwujá gukíra indwâra arayirāta.,"Quand vous partagez votre maladie, vous invitez la guérison.","When you share your sickness, you invite healing.",proverbs,,,,,,,4,31
,Uwujá gukíra urwîmo arwīma ururími.,"En temps de trouble, le silence offre une protection.","In times of trouble, silence offers protection.",proverbs,,,,,,,5,35
,Uwujá gusíga imvúra arayirorēra.,"Dans la course contre la pluie, attendre assure une fin sèche.","In the race against the rain, waiting ensures a dry finish.",proverbs,,,,,,,4,32
,Uwujá gutûnga arima abagēnzi.,"Méfiez-vous de disperser votre richesse à tous, car vous pourriez finir sans rien.","Beware of scattering your wealth to all, for you may end up with none.",proverbs,,,,,,,4,29
,Uwujá kubá mu Burŭndi agira amâso ntágirá amatwí.,"Pour se marier, il faut avoir des yeux et non des oreilles.","To get married, one must have eyes and not ears.",proverbs,,,,,,,8,49
,Uwujá kugaya ijāmbo arāba umunwa urivúze.,Celui qui ignore la parole c'est à cause de l'orateur.,He who ignores the word is because of the speaker.,proverbs,,,,,,,6,41
,Uwujá mu rugό rw'úwŭndi asiga ingeso kw'īrêmbo.,"En entrant dans la maison de quelqu'un d'autre, laissez vos manières à la porte.","When entering someone else's house, leave your manners at the door.",proverbs,,,,,,,7,47
,Uwukora Imikate n'Umubanyi.,Le boulanger est mon voisin.,The baker is my neighbor.,general,,,,,,,3,27
,Uwukêngurutse aba yôngeje.,Un cœur reconnaissant cherche davantage de bénédictions.,A grateful heart seeks more blessings.,proverbs,,,,,,,3,26
,Uwukíze inkúba arayígānīra.,Ceux qui échappent de justesse au danger racontent l'histoire à quiconque veut l'écouter.,Those who narrowly escape danger tell the story to anyone who will listen.,proverbs,,,,,,,3,27
,Uwukíze isěmu yībagira icămwīrukana.,"Dans les bons moments, les cicatrices des épreuves sont facilement négligées.","In good times, the scars of hardship are easily overlooked.",proverbs,,,,,,,4,36
,Uwukíze ubusóre arabuganira.,"Quand un homme quitte le chemin solitaire, que les cloches joyeuses sonnent et que le cœur des amis brille.","When a man leaves the single road, let joyous bells ring and friends' hearts be glowed.",proverbs,,,,,,,3,28
,Uwukóma amashí ntákubítwa kū ntoke.,"Ne détournez pas la main tendue, car elle porte un appel à l'aide.","Do not turn away from the outstretched hand, for it carries a plea for help.",proverbs,,,,,,,5,35
,Uwukúbita igishěgu arakijāniranya (arakirīndira).,"Si tu commences une guerre, prépare-toi à te battre jusqu'à la fin.","If you start a war, prepare to fight until the end.",proverbs,,,,,,,4,49
,Uwukúbita inkēnde ntárābíra iyiháka.,"Un cœur malveillant ne fait pas de distinction, nuisant à tous sur son passage.","A heart of malice knows no distinction, harming all in its path.",proverbs,,,,,,,4,36
,Uwukúrusha umugóre akurusha urugó.,"Une maison avec une bonne femme est comme un jardin fleuri de roses, tandis qu'une maison sans elle est comme un désert stérile.","A home with a good woman is like a garden flourishing with roses, while a home without one is like a barren desert.",proverbs,,,,,,,4,34
,Uwukúrāvye cāne agutēra kwāmbara.,"Lorsque les gens vous corrigent constamment, c'est un signal pour vous réévaluer.","When people are constantly fixing you, it's a signal to reevaluate yourself.",proverbs,,,,,,,4,33
,Uwumáze umwâka aba arâmvye.,Passer une année est un pas vers la longévité.,Spending a year is a step towards longevity.,proverbs,,,,,,,4,27
,Uwupfûye aba arúhūtse.,La mort apporte à l'âme fatiguée un repos éternel.,Death brings the weary soul to eternal repose.,proverbs,,,,,,,3,22
,Uwurâmvye arabόna.,"Plus vous vivez longtemps, plus vous êtes témoin et comprenez.","The longer you live, the more you witness and understand.",proverbs,,,,,,,2,18
,Uwurérewe n'Îmâna agira ngo arusha abăndi guhana.,Les gens sont simplement bénis par Dieu et pensent qu'ils sont spéciaux.,People are just blessed by God and think they are special.,proverbs,,,,,,,7,49
,Uwurí mū ntăhe arêzwa ntíyīyéza.,"Un homme juste est justifié par les faits, non par sa propre défense.","A just man is vindicated by the facts, not his own defense.",proverbs,,,,,,,5,32
,Uwurívuze mu gushēngera ntâbá agîye.,Celui qui exprime son dernier souhait avant de partir reste gravé dans le cœur de ceux qu'il laisse derrière lui.,One who expresses their last wish before passing away remains etched in the hearts of those they leave behind.,proverbs,,,,,,,5,36
,Uwurûmbije umugόre ntásārûra umwâna.,"Pour planter la graine de la vie, il faut nourrir la flamme du désir.","To plant the seed of life, one must nurture the flame of desire.",proverbs,,,,,,,4,36
,Uwushâka akêzá aragáhebera.,Les meilleures choses dans la vie valent la peine de se battre.,The best things in life are worth fighting for.,proverbs,,,,,,,3,27
,Uwushâka inká aryāma nka zό.,"Agissez comme un local, soyez traité comme un local.","Act like a local, be treated like a loca.",proverbs,,,,,,,5,28
,Uwushâka kukúrya ntáburá imbóga agukóza.,Un esprit malveillant n'a pas besoin de raison pour frapper.,A malicious mind needs no reason to strike.,proverbs,,,,,,,5,40
,Uwushâka umubíra abira akŭya.,"Si vous voulez vraiment quelque chose, soyez prêt à transpirer pour l'obtenir.","If you want something badly enough, be prepared to sweat for it.",proverbs,,,,,,,4,29
,Uwushâka umucé acīka ijoro.,La route du succès est pavée de nuits blanches.,The road to success is paved with sleepless nights.,proverbs,,,,,,,4,27
,Uwushâka urwâmo yēnga urwârwá.,"Pour créer une atmosphère animée, organisez une soirée arrosée.","To create a lively atmosphere, host a drinking gathering.",proverbs,,,,,,,4,30
,Uwusába Imâna ntásarágara.,Celui qui cherche auprès de Dieu ne se lasse jamais.,The one who seeks from God never grows weary.,proverbs,,,,,,,3,26
,Uwusába agasákanyíka aranūkirwa akîhorera.,Celui qui cherche des faveurs auprès de quelqu'un qu'il n'aime pas persévère jusqu'à obtenir ce qu'il veut.,"He who seeks favors from someone he dislikes, perseveres until he gets what he wants.",proverbs,,,,,,,4,42
clips/sound_proverb/prov028.mp3,Uwutazi umuti awunyako.,L'ignorance tue.,Ignorance kills.,proverbs,,,,,,,3,23
,Uwutsînzwe ntíbatsīndáho.,Ceux qui ont perdu méritent un cœur tendre et une main aidante.,Those who have lost deserve a tender heart and a helping hand.,proverbs,,,,,,,2,25
,Uwutábusyá abwīta ubumera.,Les personnes qui ne sont pas activement engagées ont tendance à considérer que c'est simple.,People who aren't actively engaged tend to consider it simple.,proverbs,,,,,,,3,26
,Uwutábōnyé agasóhoka ntáboná akĭnjira.,"Plus vous donnez, plus vous recevez.","The more you give, the more you receive.",proverbs,,,,,,,4,38
,Uwutáco agirá ntáco agayá.,"Quand tu ne possèdes rien, même le geste le plus simple est chéri.","When you possess nothing, even the simplest gesture is cherished.",proverbs,,,,,,,4,26
