File_Path,Kirundi_Transcription,French_Translation,English_Translation,Domain,Machine_Suggestion,Source,Duration,Speaker_id,Age,Gender,word_count,char_count
,Akayabu karyamye kuntebe.,Le chat dort sur le canapé.,The cat is sleeping on the sofa.,general,,,,,,,3,25
,Akayaga ntikagira agatotsi,L'air est pur.,The air is pure.,general,,,,,,,3,26
,Akazi kanyu nakahe?,Quel est votre travail?,What is your job?,general,,,,,,,3,19
,Akazi k’í bwămi kīca uwĭcaye.,"Le palais peut avoir de l'or, mais il a aussi de lourds fardeaux..","The palace may have gold, but it also has heavy burdens.",proverbs,,,,,,,5,29
,Akaziri karîzana.,Le malheur arrive sans annonce.,Misfortune comes without announcement.,proverbs,,,,,,,2,17
,Akaziri ntíkaziríkwa.,"Les problèmes frappent à chaque porte, grande ou petite.","Troubles knock on every door, big or small.",proverbs,,,,,,,2,21
,Akazímiye ntáho katarōndérerwa.,"Dans le labyrinthe de la perte, cherche chaque passage possible.","In the labyrinth of loss, seek every possible passage.",proverbs,,,,,,,3,31
,Akazîkīrá k'úmugabo kazīkwa n'îsí.,La tombe cache l'animosité d'un homme.,The tomb conceals a man's animosity.,proverbs,,,,,,,4,34
,Akora ikarashishi kenshi,Il fait du sport régulièrement.,He exercises regularly.,general,,,,,,,3,24
,Akora ikí ?,Que fait-il ?,What does he do?,jokes,,,,,,,3,11
,Akorera mu biro.,Il travaille dans un bureau.,He works in an office.,general,,,,,,,3,16
,Akâna k'ûmwôro kīrabura kátarogá.,La main de la pauvreté peut rendre même un bel enfant semblant abandonné.,Poverty's hand can make even a lovely child seem forlorn.,proverbs,,,,,,,4,33
,Akâna karí ubwênge gasīnzīra imbonamwūko.,Un individu sage se positionne là où les opportunités sont les plus visibles.,A wise individual positions themselves where opportunities are most visible.,proverbs,,,,,,,5,41
,Akêzá karîgura.,Un bon produit se vend de lui-même.,A good product sells itself.,proverbs,,,,,,,2,15
,Akêzá kēza umutíma.,Les choses les plus belles apportent la plus grande joie.,The most beautiful things bring the greatest joy.,proverbs,,,,,,,3,19
,Akăhabāye ntíkahavá.,"Ce qui est fait est fait, cela ne peut être défait.","What is done is done, it cannot be undone.",proverbs,,,,,,,2,20
,Akăje karêmerwa.,"Accepte la nuit, car elle dévoile les étoiles.","Accept the night, for it unveils the stars.",proverbs,,,,,,,2,16
,Akăje kárusha imbwá kwōta kaba gáshāka gushá.,Les fous se précipitent là où les anges craignent de s'aventurer.,Fools rush in where angels fear to tread.,proverbs,,,,,,,7,45
,Akămi kā mūntu ní umutíma wîwé.,Le cœur est le joyau de l'homme.,The heart is the jewel of a man.,proverbs,,,,,,,6,31
,Akănse urahéba.,Il vaut mieux abandonner une tâche impossible que de perdre du temps et de l'énergie.,It is better to abandon an impossible task than to waste time and energy.,proverbs,,,,,,,2,15
,Akŏsha umusyi kava mū ngásīro.,"Celui qui présente la tentation se trouve toujours à proximité, souvent parmi vos plus chers.","The one who presents temptation is always found close by, often among your dearest.",proverbs,,,,,,,5,30
,Akŭzuye ntíkamuríkwa.,Les faits visibles n'ont pas besoin de confirmation.,Visible facts need no confirmation.,proverbs,,,,,,,2,21
,Amaborōgo y'ûmwâgazi ntátērá impuhwe ingwe.,Les larmes de l'agneau ne touchent pas le cœur du tigre.,The lamb's tears do not move the tiger's heart.,proverbs,,,,,,,5,43
,Amabwirizwa yose ategerezwa guhindurwa mu kirundi.,Toutes les commandes doivent être traduites en Kirundi.,All orders must be translated into Kirundi.,general,,,,,,,6,50
,Amabárankúru yashíkanye inyěnzi i Buha.,Un auditeur dévoué voyage loin pour des histoires qui captivent.,A dedicated listener journeys far for tales that captivate.,proverbs,,,,,,,5,39
,Amabóko ashikîriye ubuhîye yībagira umushike.,La fatigue de l'ouvrier fatigué s'efface lorsque le trésor du succès brille devant lui.,The weary laborer's fatigue fades when the treasure of success gleams before them.,proverbs,,,,,,,5,45
,Amabóko matīndi y'úmukŏbwa asegura uwĭshe sé.,Une femme insensée aide involontairement ses propres ennemis.,A foolish woman unwittingly aids her own enemies.,proverbs,,,,,,,6,45
,Amabānga abiri ntábāngíkana.,Vous ne pouvez pas monter deux chevaux avec un derrière.,You cannot ride two horses with one behind.,proverbs,,,,,,,3,32
,Amacúmu arwānyá inzara ní amasúka.,La table de l'abondance est dressée par la main laborieuse.,The table of abundance is set by the laboring hand.,proverbs,,,,,,,5,34
,Amacúmu atērwa abagabo.,Seuls les forts peuvent supporter le poids des défis de la vie.,Only the strong can bear the weight of life's challenges.,proverbs,,,,,,,3,23
,Amaguru yītāngira ku buriri agatāhira mu mirâmbizo.,Ceux qui s'efforcent d'être à l'avant-plan finissent souvent par être à la traîne.,Those who strive to be in the forefront often end up trailing behind.,proverbs,,,,,,,7,51
,Amagára aruta amagana.,Un corps sain vaut plus que toutes les richesses.,A healthy body is worth more than all the riches.,proverbs,,,,,,,3,22
,Amagúfa abiri ntábāngíkana mw'ītáma.,On ne peut pas tenir deux os dans la bouche simultanément.,Two bones cannot be held in the mouth simultaneously.,proverbs,,,,,,,4,36
,Amagŏrwa ntásigá ayăndi.,Les ennuis ne viennent jamais seuls.,Troubles never come alone.,proverbs,,,,,,,3,24
,Amagŏrwa sí ay'ŭmwe.,"L'adversité ne discrimine pas, elle touche tout le monde.","Adversity does not discriminate, it touches everyone.",proverbs,,,,,,,3,20
,Amaherá ntíyīrírwa ahó yarāyé.,"Comme le vent, l'argent voyage et change de mains.","Like the wind, money travels and changes hands.",proverbs,,,,,,,4,30
,Amahása avyinirwa ahό yavūkíye.,Les jumeaux sont célébrés là où ils sont nés.,Twins are celebrated where they were born.,proverbs,,,,,,,4,31
,Amahóro aba mū nda.,La vraie paix se trouve dans les profondeurs de l'âme.,True peace is found in the depths of the soul.,proverbs,,,,,,,4,19
,Amahóro aruta amahōnda.,"La paix est le véritable sustento de l'âme, surpassant tout festin.","Peace is the true sustenance of the soul, surpassing any feast.",proverbs,,,,,,,3,23
,Amahóro atāngurira mu mutíma.,La paix commence de l'intérieur.,Peace starts from within.,proverbs,,,,,,,4,29
,Amahóro ava mū nda.,La paix vient de l'intérieur.,Peace is from within.,proverbs,,,,,,,5,27
,Amajambo mashasha y’Ikirundi aravuka,les Nouveaux mots Kirundi naissent,New Kirundi words are born,general,,,,,,,4,36
,"Amakenga aba menshi, aca yiva inyuma ahenura urugi, arinjira.Asanga ibirago biriko birasha, urusenge narwo rugira rufatwe.","Les doutes prennent le dessus,puis il prend tout ces forces et poussant la porte, dès l'entrée il voit le tapis qui prenait feu et le toit etait sur le point de prendre le feu.","Doubts take over, then he takes all his strength and pushes the door, as soon as he enters he sees the carpet catching fire and the roof was about to catch fire.",general,,,,,,,16,122
,Amakúru atarímwo umukúru yāma arí amazímwe.,L'histoire est solide quand elle est confirmée par une voix officielle.,The story is solid when it echoes from the official voice.,proverbs,,,,,,,6,43
,Amanyáma arasara ntásabá.,L'arrogance disparaît face au besoin.,Arrogance disappears in the face of need.,proverbs,,,,,,,3,25
,Amanyáma atērwa n'ágashămbara.,L'arrogance est une ombre de prospérité qui disparaît avec l'adversité.,Arrogance is a shadow of prosperity that disappears with adversity.,proverbs,,,,,,,3,30
,Amarira ní umuheto w'úruhînja.,Les larmes sont le moyen pour un bébé d'exprimer ses besoins.,Tears are a baby's way of expressing needs.,proverbs,,,,,,,4,30
,Amarára ntágurá inyama.,Un désir excessif n'aboutit pas toujours à des résultats favorables.,Excess desire doesn't always lead to favorable outcomes.,proverbs,,,,,,,3,23
,Amaráso ava mu ruguma.,Une blessure libérera toujours du sang.,A wound will always release blood.,proverbs,,,,,,,4,22
,Amasabo aguma nk'ámabuye.,Demander de l'aide peut être une tâche redoutable.,Requesting assistance can be a daunting task.,proverbs,,,,,,,3,25
,Amasabo akwănkiye arāba imirázi.,Les signes d'échec apparaissent souvent dès le début.,The signs of failure often appear from the very beginning.,proverbs,,,,,,,4,32
,Amasabo arakíza.,Chercher de l'aide est la clé pour surmonter les défis.,Seeking help is the key to overcoming challenges.,proverbs,,,,,,,2,16
,Amasabo arîca.,Toujours s'appuyer sur les autres peut entraver la croissance personnelle.,Always leaning on others can hinder personal growth.,proverbs,,,,,,,2,14
,Amashure matoya atunganijwe mu myaka itandatu,L'école primaire est organisé  en six ans,Primary school is organized in six years,general,,,,,,,6,45
,Amashure yisumbuye,Écoles secondaires,Secondary schools,general,,,,,,,2,18
,Amashurwe ni meza.,Les fleurs sont belles.,The flowers are beautiful.,general,,,,,,,3,18
,Amasé ya kêra ntáhomá urutaro.,Les coutumes du passé ne correspondent plus aux comportements d'aujourd'hui.,The customs of the past no longer align with the behaviors of today.,proverbs,,,,,,,5,30
,Amasîndé y'înkúmi ntárārá.,Un champ dégagé d'une jeune fille ne reste pas inactif longtemps.,A cleared field of a young maiden doesn't stay idle for long.,proverbs,,,,,,,3,26
,Amasūnzu sí amasáka.,Ne tirez pas de conclusions basées sur l'apparence.,Don't jump to conclusions based on looks.,proverbs,,,,,,,3,20
,Amatwí yūmva icó umutíma ushasháye.,"Nous ne voyons pas les choses telles qu'elles sont, nous les voyons telles que nous sommes.","We don't see things as they are, we see things as we are.",proverbs,,,,,,,5,35
,Amaté mabí ní ayagîye gusa.,Même une petite portion vaut mieux que le vide complet.,Even a small portion is better than complete emptiness.,proverbs,,,,,,,5,27
,Amatégeko aremēra nk'ámabuye.,Les lois sont aussi rigides que les montagnes.,Laws are as rigid as mountains.,proverbs,,,,,,,3,29
,Amavuta ayamusuka ku mutwe,Elle lui a versé de l'huile sur la tête,She poured the oil on his head,grammar,,,,,,,4,26
,Amayira y'íshāmba amenywa n'îmêndé.,"Pour gagner en perspicacité, apprends de ceux qui ont vu la vue.","To gain insights, learn from those who have seen the view.",proverbs,,,,,,,4,35
,"Amaze gutaha, yabonye abashitsi","Lorsqu'il fut rentré chez lui, il vit les visiteurs.",When he had gone home he saw the visitors.,grammar,,,,,,,4,31
,"Amaze imisi mirongwine yisonzesheje, abona gusonza",Il a jeûné pendant 40 jours et puis il a eu faim,He fasted for 40 days and then he was hungry,grammar,,,,,,,6,50
,"Amaze kuvuga artyo, aduzwa babona","Après avoir parlé ainsi, il fut repris, ils le voyant",Having spoken thus he was taken up they seeing it,grammar,,,,,,,5,33
,Amazi arakanye.,L'eau est froide.,The water is cold.,general,,,,,,,2,15
,Amazi asa neza,L'eau est très propre.,The water is very clean.,general,,,,,,,3,14
clips/sound_proverb/prov016.mp3,Amazi masabano ntamara imvyiro.,Travailler dur est plus gratifiant que de dépendre de l’aumône.,Working hard is more rewarding than depending on handouts.,proverbs,,,,,,,4,31
,Amazi ni meza.,L'eau est très propre.,The water is very clean.,general,,,,,,,3,14
,Amazina yawe ni ayahe?,Quel est votre nom?,What is your name?,general,,,,,,,4,22
,Amenya neza adakekeranya yukw ico yasezeranye ishobora no kugikora,"Il savait bien, sans douter, que ce qu'il avait promis, il était également capable de le faire.",He knew well without doubting that that which he had promised he was able also to do,grammar,,,,,,,9,66
,Amáta y'ûmwôro ní umúfa.,"Dans le silence de la solitude, une voix douce est une musique pour les oreilles.","In the silence of loneliness, a soft voice is music to the ears.",proverbs,,,,,,,4,24
,Amâso arasuma arí kure.,"Même à distance, les yeux peuvent faire un achat.","Even from a distance, eyes can make a purchase.",proverbs,,,,,,,4,23
,Amâso y'íbikére ntábuzá abavôma.,"Vos actions vous appartiennent, indépendamment de l'opinion des autres.","Your actions are yours to choose, regardless of others' opinions.",proverbs,,,,,,,4,32
,Amâso y'ύwŭndi ntágushĭmira umugeni.,Personne ne peut pleinement saisir la beauté de ta femme comme toi.,No one can fully grasp the beauty of your wife like you do.,proverbs,,,,,,,4,36
,Amâzi arashûha ntíyībágira i bŭmbehó.,"Pendant que vous atteignez de grandes hauteurs, ne perdez pas de vue vos origines et ceux qui vous ont soutenu.","While you achieve great heights, don't lose sight of your origins and the ones who supported you.",proverbs,,,,,,,5,37
,Amâzi asūmira ku mabuye.,L'eau crée du bruit ou du son lorsqu'elle rencontre des obstacles comme des pierres sur son chemin.,Water creates noise or sound when it encounters obstacles like stones in its path.,proverbs,,,,,,,4,24
,Amâzi iyό abāyé maké aharirwa impfîzi.,"En période de pénurie, les plus forts s'accaparent tout.","In times of scarcity, the strongest claim it all.",proverbs,,,,,,,6,38
clips/sound_proverb/prov016.mp3,Amâzi masabano ntámará imvyíro.,Travailler dur est plus gratifiant que de dépendre de l’aumône.,Working hard is more rewarding than depending on handouts.,proverbs,,,,,,,4,31
,Amênyo aragutwēnga arí ayâwé.,"Dans certaines situations, on peut trouver de l'humour en examinant comment on a pris une certaine décision malheureuse.","In certain situations, you can find humor in examining how you made a certain unfortunate decision.",proverbs,,,,,,,4,29
,Amênyo araryâna kăndi yêra.,Des dents blanches peuvent cacher une douleur invisible.,White teeth may hold unseen pain.,proverbs,,,,,,,4,27
,Amênyo aratwēnga asíze intîmba mū nda.,Un visage joyeux peut cacher un cœur tourmenté.,A cheerful face may mask a troubled heart.,proverbs,,,,,,,6,38
,Amîshitso y'úmugeni yōza inkόno icūmbá.,Son comportement est particulièrement agréable lorsqu'elle vient de se marier.,Her behavior is especially pleasant when she's just married.,proverbs,,,,,,,5,39
,Amôsozi y'úmugabo atēmba ája mū nda.,Les larmes de l'homme tombent dans le puits de son cœur.,Man's tears fall into the well of his heart.,proverbs,,,,,,,6,36
,Amûnguranká ní yo mazíkēsha.,"Gardez les yeux ouverts, ce qui est bénéfique aujourd'hui peut devenir un fardeau demain.","Keep your eyes open, what's beneficial today can become a burden tomorrow.",proverbs,,,,,,,4,28
,Amēru y'úmukwé amara indŏngoranywa.,"Lorsque l'irresponsabilité et la cupidité se combinent, un homme peut épuiser ses ressources avant de remplir leur objectif initial.","When irresponsibility and greed combine, a man might exhaust his resources before fulfilling their original purpose.",proverbs,,,,,,,4,35
,Arabimenyesha mw’ijambo ashikiriza abanyagihugu.,Il va l'annoncer dans son discours au peuple.,He will announce it in his speech to the people.,general,,,,,,,4,48
,Araciye ubwenge gose.,Elle est très intelligente.,She is very intelligent.,general,,,,,,,3,21
,Araciye ubwenge.,Elle est très intelligente.,She is very intelligent.,general,,,,,,,2,16
,Arafata za Vitamini.,Elle prend des vitamines.,She takes vitamins.,general,,,,,,,3,20
,Aragapfa!,Laissez-le mourir,Let him die,grammar,,,,,,,1,9
,Arakora ikinga.,Il répare la bicyclette.,He repairs the bicycle.,general,,,,,,,2,15
,Arakora imyimenyerezo kenshi gashoboka,Il fait du sport régulièrement.,He exercises regularly.,general,,,,,,,4,38
,Arakora imyimenyerezo yo kwigorora.,Elle fait du yoga.,She does yoga.,general,,,,,,,4,35
,Arandika ibaruwa.,Elle écrit une lettre.,She writes a letter.,general,,,,,,,2,17
,Ararwaye,Il est malade,He is ill,grammar,,,,,,,1,8
,Aratwara imodoka,Il conduit une voiture.,He drives a car.,general,,,,,,,2,16
,Aratwara umuduga.,Il conduit une voiture.,He drives a car.,general,,,,,,,2,17
