ID,File_Path,Kirundi_Transcription,French_Translation,English_Translation,Domain,Machine_Suggestion,Source,Duration,Speaker_id,Age,Gender,Audio_Status
krd_000601_grammar,,Icompa singende,J'espère que je n'y vais pas,I hope I don’t go,grammar,,,,,,,pending
krd_000602_grammar,,Icoroshe ni kihe?,Qu'est-ce qui est le plus simple ?,Which is easier?,grammar,,,,,,,pending
krd_000603_grammar,,Icupa ririmwo amata,Le biberon contient du lait,The bottle contains milk,grammar,,,,,,,pending
krd_000604_proverbs,,Icó Imâna igutútse ní co kikwĭca.,La malédiction de Dieu devient la cause de votre perte.,God's curse becomes the cause of your demise.,proverbs,,,,,,,pending
krd_000605_proverbs,,Icó iguhá n'îcó ikuvyărira birāngana.,"Deux trésors d'une seule origine, nous rappelant la richesse de l'existence.","Two treasures from one origin, reminding us of the richness of existence.",proverbs,,,,,,,pending
krd_000606_proverbs,,Icó uhāwé n'úgutôra ucākwa n'úgutâkara.,"Facile à obtenir, facile à perdre.","Easy come, easy go.",proverbs,,,,,,,pending
krd_000607_proverbs,,Icó umuryāngo utāzí ntíkimenywá na bárŭndi.,Les étrangers ne peuvent pas savoir ce qui est caché à la famille immédiate.,Outsiders cannot know what is hidden from the immediate family.,proverbs,,,,,,,pending
krd_000608_proverbs,,Icó umutíma ukūnzé isógo zisūmba inyama.,Les vrais désirs ne peuvent pas être facilement remplacés par autre chose.,True desires cannot be easily replaced by something else.,proverbs,,,,,,,pending
krd_000609_proverbs,,Icó umuvyêyi asizé ní co aragá.,Ce qu'un parent laisse derrière lui est la véritable richesse de la famille.,What a parent leaves behind is the true wealth of the family.,proverbs,,,,,,,pending
krd_000610_proverbs,,Icó umuvyêyi asizé ní co arerérwa.,La richesse qu'un parent laisse détermine la vie de leurs enfants.,The wealth a parent leaves behind determines their children's life.,proverbs,,,,,,,pending
krd_000611_proverbs,,Icó umūntu akorá ní co kimukóra.,Votre travail façonne ce que vous êtes.,Your work shapes who you are.,proverbs,,,,,,,pending
krd_000612_proverbs,,Icó utarâbόna ucērekwa n'úkurāmba.,Le temps révèle ce qui était autrefois caché.,Time reveals what was once hidden.,proverbs,,,,,,,pending
krd_000613_proverbs,,Icăyāye gihayira umukêbá akarí mu gihogero.,L'insensé révèle fièrement ses trésors à l'adversaire.,The fool proudly reveals his treasures to the adversary.,proverbs,,,,,,,pending
krd_000614_proverbs,,Icăyāye kivugira ibicúba ku macúniro.,Chanter pour les vaches alors qu'elles marchent vers l'abattoir est un acte insensé.,"Chanting for cows as they march to the slaughter, a foolish act.",proverbs,,,,,,,pending
krd_000615_proverbs,,Icĭmenyēre cītiranya amatúruka n'ámatāha.,De mauvaises habitudes mènent à de mauvais jugements.,Wrong habits lead to misjudging situations.,proverbs,,,,,,,pending
krd_000616_proverbs,,Icĭvyāra ní ingwe.,"Tel père, tel fils.","Like father, like son.",proverbs,,,,,,,pending
krd_000617_action-verbs,,Iduka iruguruye?,Le magasin est-il ouvert?,Is the store open?,action-verbs,,,,,,,pending
krd_000618_action-verbs,,Iduka yoba yuguruye ?,Le magasin est-il ouvert?,Is the store open?,action-verbs,,,,,,,pending
krd_000619_grammar,,Iduka yugaye kuwimana.,Le magasin est fermé le dimanche.,The store is closed on Sundays.,grammar,,,,,,,pending
krd_000620_action-verbs,,Ifirigo ikanyisha iragaragara,Le frigo est vide.,The fridge is empty.,action-verbs,,,,,,,pending
krd_000621_jokes,clips/jokes/h5.mp3,Ifuku itambiye mu mwobo iti nari nzi gutamba nuko mbuze abandorera!,"""Je suis une danseuse étoile mais je n'ai pas de spectateurs, hélas."", comme disait la Taupe en gambadant au pied de sa chaumière !","""I am a prima ballerina but I have no spectators, alas."", as the Mole said frolicking at the bottom of her cottage!",jokes,,,,,,,recorded
krd_000622_jokes,clips/jokes/h9.mp3,Ifundi bayihushije icumu iraheza iti i Nyamiyaga haragiriwe!,Comme le disait le rouge-gorge après avoir esquivé un coup de lance : « Le pays du vent est très occupé !,"As the robin said after dodging a spear blow: ""The land of the wind is very busy!""",jokes,,,,,,,recorded
krd_000623_jokes,clips/jokes/h47.mp3,Ifundi bayikubise inkoni umunani iti reka izo niko ndeha!,"""Assez ! Vos longueurs de baguette sont à ma taille"", comme disait le rouge-gorge fustigé à huit coups !","""Enough! Your baguette lengths are just my size"", as the robin who had been castigated eight blows said!",jokes,,,,,,,recorded
krd_000624_jokes,clips/jokes/h24.mp3,Ifundi irwaye impanga iti nahora ndi muto narirya none naho ubu ntivyunyutse!,"""Ma taille est et a toujours été minuscule et mon grossissement actuel ne me rend pas plus imposant"", comme disait le rouge-gorge, accablé d'une hernie !","""My size is and has always been tiny and my current increase does not make me more imposing"", as the robin said, burdened with a hernia!",jokes,,,,,,,recorded
krd_000625_jokes,clips/jokes/h4.mp3,Ifundi itembanywe n'umuvo iti ndi ku mirimo y'ibwami iyo bandoresha sinanka!,"""Je ne refuse pas d'aller là où on m'envoie, ne suis-je pas au service de la royauté ?"", comme disait le rouge-gorge, entraîné par l'eau d'un ravin !","""I don't refuse to go where I'm being sent, Am I not in the service of royalty?"", as the robin said, driven by the water of a gully!",jokes,,,,,,,recorded
krd_000626_jokes,clips/jokes/h41.mp3,"Ifundi yugamye musi y'igitikatika amama y'imvura ngo pa pa pa, nayo iti nari bwabe umwami ntaravugirwa n'ingoma!","""Sans le tambour qui battait en mon honneur, je n'aurais pas été roi."", comme disait le rouge-gorge abrité sous une colocase de feuilles où tambourinaient les gouttes de pluie !","""Without the drum beating in my honor I would not have been king."", as said the robin sheltered under a leaf colocase where raindrops drummed!",jokes,,,,,,,recorded
krd_000627_proverbs,,Ifí ntímenyá ikirâza ishîngá urusěnga.,La grenouille n'est pas consciente de l'approche du serpent.,The frog is not aware of the snake's approach.,proverbs,,,,,,,pending
krd_000628_proverbs,,Ifí yāma mu mâzi ikāmana inyôta.,"Même dans l'abondance, le cœur peut rester insatisfait.","Even with abundance, the heart can remain unsatisfied.",proverbs,,,,,,,pending
krd_000629_proverbs,,Ifúku itāzí agaheza ishōra agatwé ku mushíbuká.,Ceux qui ignorent les conséquences jouent avec leurs causes.,Those unaware of the consequences play with their causes.,proverbs,,,,,,,pending
krd_000630_proverbs,,Igabo rigira uwĭyubakiye.,La vraie fierté est réservée à ceux qui sont autosuffisants.,True pride is reserved for those who are self-sustaining.,proverbs,,,,,,,pending
krd_000631_proverbs,,Igera ntíritegá imvubú.,Un hameçon ne fait pas le poids face à la force d'un hippopotame.,A fish hook is no match for a hippo's strength.,proverbs,,,,,,,pending
krd_000632_proverbs,,Igice cambere kiraheze.,Fin de la première partie,End of the first part,proverbs,,,,,,,pending
krd_000633_general,,Igiharuro kabanga sico.,Le mot de passe est incorrect.,The password is incorrect.,general,,,,,,,pending
krd_000634_grammar,,"Igihe abashitsi bazozira, tuzoba twiteguye","Quand les visiteurs viendront, nous serons prêts","When the visitors come, we will be ready",grammar,,,,,,,pending
krd_000635_proverbs,,Igihe caheze kiri inyuma yacu.,Le passé est derrière nous.,The past is behind us.,proverbs,,,,,,,pending
krd_000636_general,,Igihe cimbeho ni kirekire kandi kirakanye,L'hiver est long et froid.,Winter is long and cold.,general,,,,,,,pending
krd_000637_jokes,,Igihe cöse ndāvyé mū ngodo yānje ntā na kímwe mboná.,"Chaque fois que je regarde dans mon portefeuille, je ne vois rien.","Every time I peer into my wallet, it seems like there's nothing to see.",jokes,,,,,,,pending
krd_000638_grammar,,Igihe mutangura igikorane nzoba naje,"Quand tu commenceras la réunion, je serai venu","When you start the meeting, I will have come",grammar,,,,,,,pending
krd_000639_grammar,,Igihe mwaje i wacu twakora mu murima,"Quand tu es venu chez nous, nous travaillions dans le jardin",When you came to our place we were working in the garden,grammar,,,,,,,pending
krd_000640_grammar,,"Igihe mwasohotse mw'ishuri, mwari bangahe?","Quand vous avez terminé vos études, combien étiez-vous ?","When you graduated from school, how many were you?",grammar,,,,,,,pending
krd_000641_proverbs,,Igihere giheza umugabo mū nzu.,Même un petit problème peut pousser un homme à chercher la solitude pour éviter les questions.,Even a tiny problem can make a man seek solitude to avoid inquiries.,proverbs,,,,,,,pending
krd_000642_jokes,clips/jokes/h48.mp3,Igihimbi bagiciye umurizo kiti ni ukuri ikitambabaje ni ico!,"""En vérité, je m'en fiche."", comme disait le serval dont la queue avait été coupée !","""In truth, I don't care."", as said the serval whose tail had been cut off!",jokes,,,,,,,recorded
krd_000643_jokes,clips/jokes/h30.mp3,"Igihimbi bagikubitiye mu bigori kiraheza kiraboroga kiti jewe Sagihimbi umwaka utaha ukuntu, sinari bwakubitirwe mu bigori!",""" Moi, maître Serval, c'est mon festin ; jamais auparavant je n'avais été frappé au milieu d'un champ de maïs "", gémit le serval après avoir reçu un dégel au milieu du maïs !","""I, Master Serval, this is my feast; never before had I been hit in the middle of a cornfield,"" groaned the serval after receiving a thaw among the corn!",jokes,,,,,,,recorded
krd_000644_proverbs,,Igihugu batansaba urupapuro kugira ndekurirwe kuhaba,Le pays ou on me demande pas un document pour pouvoir rester,The country where I am not asked for a document to be able to stay,proverbs,,,,,,,pending
krd_000645_proverbs,,Igihugu gitegerezwa kwitaho umuryango.,La nation doit prendre soin de la famille.,The nation must take care of the family.,proverbs,,,,,,,pending
krd_000646_action-verbs,,Igikanyisha kiragaragara.,Le frigo est vide.,The fridge is empty.,action-verbs,,,,,,,pending
krd_000647_jokes,clips/jokes/h11.mp3,Igikembekembe gifashe rwungere mu nyo kiti i Nyamiyaga haratashwe!,"""Le pays des vents est bien fréquenté"", comme disait l'herbe acérée en blessant un oiseau berger dans le derrière !","""The land of the winds is well frequented"", as the sharp grass said by injuring a shepherd bird in the behind!",jokes,,,,,,,recorded
krd_000648_jokes,clips/jokes/h31.mp3,Igikere bakijuguniye inyuma y'urugo kiti injugujugu iy'iba itavuna umugongo yunguruza!,"""Si cette trajectoire ne risque pas de me casser le dos, c'est certainement un moyen rapide de se déplacer"", comme le disait le crapaud qui avait été projeté derrière le corral !","""If this trajectory did not risk breaking my back, it is certainly a fast way to get around"", as the toad that had been thrown behind the corral said!",jokes,,,,,,,recorded
krd_000649_jokes,clips/jokes/h32.mp3,Igikere bakirengeje urugo kiti ugusimba iyo kutaba kwaca umugongo kwaca intaho!,"""Si cette façon de sauter ne risquait pas de me casser les reins, ce serait une excellente façon de rentrer à la maison."" comme disait le crapaud qui avait été jeté sur le corral !","""If this way of jumping did not risk breaking my kidneys, that would be a great way to get home."" as the toad that had been thrown over the corral said!",jokes,,,,,,,recorded
krd_000650_jokes,clips/jokes/h28.mp3,"Igikere cambaye uruyonga kiti nzira ico mparaye, nzohava mvunika!","""Je risque de me casser un membre car la nouveauté ne me convient pas"", dit la grenouille après avoir enfilé sa jupe !","""I'm likely to break a limb for novelty does not suit me"", said the frog after putting on her skirt!",jokes,,,,,,,recorded
krd_000651_jokes,clips/jokes/h7.mp3,Igikobekobe cavuye hejuru cikubita hasi kiti nkambura umwana wanje nkaba ngisubira hejuru!,"""Malheur à moi si jamais je retourne là-haut"", comme disait la Feuille de ficus tombant du haut de l'arbre sur le sol !","""Woe to me if I ever go back up there"", as the ficus Leaf said falling from the top of the tree onto the ground!",jokes,,,,,,,recorded
krd_000652_grammar,,Igikomere giteba ikiza,un ulcère qui tarde à guérir,an ulcer that is slow to heal,grammar,,,,,,,pending
krd_000653_proverbs,,Igikéburwa nticûmve ní imbwá kw'īgúfa.,Un chien qui mange un os n'entend aucun appel.,"While eating a bone, a dog hears no call.",proverbs,,,,,,,pending
krd_000654_general,,Igipapuro civyo gusuma kiri kumeza.,La liste de courses est sur la table.,The shopping list is on the table.,general,,,,,,,pending
krd_000655_proverbs,,Igisânīrá gica umwāno ishíga ryîkoreye.,Un parent peut parfois se comporter de manière désagréable.,A relative can occasionally behave in ways that are disagreeable.,proverbs,,,,,,,pending
krd_000656_proverbs,,Igisúma ní igifáshwe.,Le vrai voleur est démasqué lorsqu'il est pris la main dans le sac.,The true thief is exposed when caught red-handed.,proverbs,,,,,,,pending
krd_000657_grammar,,Igitabu kiri ku meza,Le livre est sur la table.,The book is on the table.,grammar,,,,,,,pending
krd_000658_proverbs,clips/proverbs/prov003.mp3,Igiti umuntu aturira ntakirangamiza.,On n'est pas censé avoir des pensées lubriques pour ce à quoi on n'a pas droit.,One is not supposed to have lustful thoughts for what one has no right to.,proverbs,,,,,,,recorded
krd_000659_proverbs,,Igitíka mu mapfá cīyita Bāndyabângaya.,"Pendant la famine, les gens consomment des choses qu'ils n'apprécient même pas.","During famine, people consume things they don't even enjoy.",proverbs,,,,,,,pending
krd_000660_proverbs,,Igitó gita uwagíkōye ntígitá uwakívyāye.,"Une femme insensée peut quitter son homme, mais jamais ses parents.","A foolish woman might part ways with her man, but never with her parents.",proverbs,,,,,,,pending
krd_000661_jokes,,Igitúma s’íkìíndi nūkó dushāká kó abâna bâcu bazôsânga zârahéze.,la raison est simple : nous voulons que nos enfants naissent dans un monde où il n'y a plus d'alcool.,the reason is simple: we want our kids to be born into a world where there's no more alcohol.,jokes,,,,,,,pending
krd_000662_action-verbs,,Igurwa angahe ?,Combien ça coûte?,How much does it cost?,action-verbs,,,,,,,pending
krd_000663_proverbs,,Igípfa câbúriwe ní impōngo.,Un idiot peut tomber dans un piège malgré l'avertissement.,A fool can stumble into a trap despite the warning.,proverbs,,,,,,,pending
krd_000664_proverbs,,Igíti căgukoze mu jîsho cāma gíhiritse.,"Après une erreur, restez vigilant, répéter les mêmes causes conduit aux mêmes conséquences.","After stumbling from a mistake, stay vigilant, repeating the same causes leads to the same outcomes.",proverbs,,,,,,,pending
krd_000665_proverbs,,Igíti cīkwîje amáhwa gitēra inkēnde amakēnga.,Un arbre plein d'épines rend les singes méfiants.,A tree full of thorns leaves monkeys suspicious.,proverbs,,,,,,,pending
krd_000666_proverbs,,Igíti cīswé ingoma ntikibāzwá.,"Un tambour reste toujours un tambour, il ne peut pas être transformé en autre chose.","A drum always remains a drum, it cannot be transformed into something else.",proverbs,,,,,,,pending
krd_000667_proverbs,,Igíti cīswé umwâna ntígicānwá.,"Pendant les conflits, assurez-vous que le bien-être des enfants est protégé.","During conflicts, ensure the well-being of children is safeguarded.",proverbs,,,,,,,pending
krd_000668_proverbs,,Igíti cūmyé cēgamira kibísi.,"À l'ombre de la jeunesse, la vieillesse trouve le repos.","In the shade of youth, old age finds rest.",proverbs,,,,,,,pending
krd_000669_proverbs,clips/proverbs/prov005.mp3,Igíti kigorōrwa kíkiri gitó.,Un arbre se redresse alors qu’il est encore jeune.,A tree is straightened while it is still young.,proverbs,,,,,,,recorded
krd_000670_proverbs,,Igíti kigwa iyό gihēngámiye.,"Comme l'arbre penche, ainsi il tombera.","As the tree leans, so shall it fall.",proverbs,,,,,,,pending
krd_000671_proverbs,,Igíti kimwé ntíkibá ishāmba.,Un seul arbre ne peut créer une forêt.,A single tree cannot create a forest.,proverbs,,,,,,,pending
krd_000672_proverbs,,Igíti kirakúrira mu babāji.,"Tout comme un charpentier compétent peut transformer un simple morceau de bois en chef-d'œuvre, les conseils des experts peuvent nous aider à dépasser notre potentiel initial.","Just like a skilled carpenter can turn an ordinary piece of wood into a masterpiece, the guidance of experts can help us excel beyond our initial potential.",proverbs,,,,,,,pending
krd_000673_proverbs,clips/proverbs/prov025.mp3,Ijambo rigukunze riguma mu nda.,Il ne faut pas prononcer de gros mots.,Bad words should not be spoken.,proverbs,,,,,,,recorded
krd_000674_proverbs,,Ijana ntíryānká mu rĭndi.,On ne peut jamais avoir trop d'une bonne chose.,You can't have too much of a good thing.,proverbs,,,,,,,pending
krd_000675_proverbs,,Ijoro ritanga impanuro.,La nuit porte conseil.,The night brings advice.,proverbs,,,,,,,pending
krd_000676_general,,Ijoro ryiza.,Bonne nuit.,Good night.,general,,,,,,,pending
krd_000677_general,,Ijwi ry'Imikuba y'amazi riraruhura.,Le son des vagues est apaisant.,The sound of the waves is calming.,general,,,,,,,pending
krd_000678_general,,Ijwi ry'imikuba riraruhura,Le son des vagues est apaisant.,The sound of the waves is calming.,general,,,,,,,pending
krd_000679_proverbs,,Ijîsho Nyawĭkwēgera riha abakwé ibinóko.,Rejeter tous ceux qui approchent peut laisser une femme seule à la fin.,Rejecting all who approach may leave a woman alone in the end.,proverbs,,,,,,,pending
krd_000680_proverbs,,Ijîsho riguséma n'írigúhēzagira ntákanurá kumwé.,"Un œil bénissant brille de gentillesse, tandis qu'un œil maudit lance des éclairs de malveillance.","A blessing eye shines with kindness, while a cursed eye glares with malice.",proverbs,,,,,,,pending
krd_000681_proverbs,,Ijîsho rigēnzwá n'ákăndi rigushīma akêmo.,"Dans la poursuite de leurs objectifs, les gens peuvent vous couvrir d'éloges, même mineurs, pour gagner vos faveurs.","In the pursuit of their objectives, people may shower you with praise, no matter how minor, to gain your favor.",proverbs,,,,,,,pending
krd_000682_proverbs,,Ijîsho ry'úwŭndi ntírigushĭmira umugeni.,Les yeux des autres ne peuvent apprécier la beauté de votre femme.,The eyes of others cannot appreciate the beauty of your wife.,proverbs,,,,,,,pending
krd_000683_action-verbs,,Iki gikorwa kirarambira.,Ce travail est ennuyeux.,This job is boring.,action-verbs,,,,,,,pending
krd_000684_grammar,,Iki gitabo ni rwanje,Ce livre est à moi,This book is mine,grammar,,,,,,,pending
krd_000685_grammar,,Iki gitoke ni ic’iwanje,Ce bananier est à moi,This banana tree is mine,grammar,,,,,,,pending
krd_000686_jokes,,"Iki gitōke n amafaranga íbihūmbi bibiri gusa bòósi, Dātá : Uwòóguha amajana atatu ntíwōyarya ??","Ceci ne coûte que deux mille francs, patron.""
Mon père : ""deux cent francs suffisent pour toi.""","These only cost two thousand francs, boss.

My dad: ""BIF two hundred is enough for you.""",jokes,,,,,,,pending
krd_000687_vocabulary,,Iki ni igihere.,Ceci est un punaise de lit.,This is a bedbug.,vocabulary,,,,,,,pending
krd_000688_vocabulary,,Iki ni igitabo.,Ceci est un livre.,This is a book.,vocabulary,,,,,,,pending
krd_000689_vocabulary,,Iki ni igitunguru.,Ceci est un oignon.,This is a onion.,vocabulary,,,,,,,pending
krd_000690_vocabulary,,Iki ni ikijumbu.,Ceci est un patate douce.,This is a sweet potato.,vocabulary,,,,,,,pending
krd_000691_vocabulary,,Iki ni ikirahuri.,Ceci est un verre.,This is a glass.,vocabulary,,,,,,,pending
krd_000692_action-verbs,,Ikibikamuriro kiragaragara.,La batterie est faible.,The battery is low.,action-verbs,,,,,,,pending
krd_000693_proverbs,,Ikibwîrwa ní icŭmva icěrekwa ní ikibóna.,"Quand les sages vous donnent des conseils, écoutez et suivez.","When the wise give you advice, listen and follow.",proverbs,,,,,,,pending
krd_000694_proverbs,,Ikigútwāye umutíma ní co kigutwăra agatwé.,Une préoccupation qui vous tient à cœur peut conduire à votre perte.,A preoccupation that holds your heart can lead to your demise.,proverbs,,,,,,,pending
krd_000695_proverbs,,Ikimúga gisūmba imvá.,Mieux vaut un moineau vivant qu'un aigle empaillé.,Better a live sparrow than a stuffed eagle.,proverbs,,,,,,,pending
krd_000696_proverbs,,Ikimúga gitāmba cânyôye.,Le pouvoir de l'alcool peut faire danser n'importe qui sans retenue.,The power of alcohol can make anyone dance with abandon.,proverbs,,,,,,,pending
krd_000697_jokes,clips/jokes/h42.mp3,Ikinyugunyugu gitwawe n'umuyaga ngo nari bwabe umwami ntararerurwa!,"""Sans avoir déjà été porté dans une litière je n'aurais pas été un roi légitime"", comme disait le papillon emporté par le vent !","""Without having already been worn in litter I would not have been a legitimate king,"" as the butterfly carried away by the wind said!",jokes,,,,,,,recorded
krd_000698_proverbs,,Ikinyóma cûmvīse ukúri kimena urūgi.,"Quand la vérité approche, les mensonges prennent la fuite.","When truth approaches, lies make their exit.",proverbs,,,,,,,pending
krd_000699_proverbs,,Ikinyóma cā nyéne urugó bagiha intébe kikīcaráko.,Le mensonge du chef de famille passe comme une lettre à la poste.,The lie of the head of the family passes like a letter in the mai.,proverbs,,,,,,,pending
krd_000700_proverbs,,Ikinyóma cīca nyené co.,Un mensonge charge le menteur de conséquences.,A lie burdens the liar with consequences.,proverbs,,,,,,,pending
